{
  "$schema": "../../schemas/conformance-platform-evidence.schema.json",
  "schemaVersion": 1,
  "standardId": "edge-canon.next",
  "suiteId": "EC-ENV",
  "status": "draft-non-certifying",
  "observedAt": "2026-09-05T04:21:32Z",
  "artifactSha256": "48bb913017b3b47c3fabb4ee67ea1eebeed10e07a8147e501090c23ff3c666f8",
  "referenceImplementationPath": "conformance/harness/environment-secrets/reference-runtime.mjs",
  "referenceImplementationSha256": "55a29979dbff2bb34b72238087306b9ff67039ba94c0c61edd61a444bff9637c",
  "observations": [
    {
      "platform": "linux",
      "osVersion": "Linux 6.8.0-124-generic",
      "architecture": "x86_64",
      "nodeVersion": "v24.20.0",
      "outcome": "pass",
      "caseCount": 12,
      "artifactSha256": "48bb913017b3b47c3fabb4ee67ea1eebeed10e07a8147e501090c23ff3c666f8"
    },
    {
      "platform": "macos",
      "osVersion": "macOS 26.6 (Darwin 25.6.0)",
      "architecture": "arm64",
      "nodeVersion": "v26.0.0",
      "outcome": "pass",
      "caseCount": 12,
      "artifactSha256": "48bb913017b3b47c3fabb4ee67ea1eebeed10e07a8147e501090c23ff3c666f8"
    },
    {
      "platform": "windows",
      "osVersion": "Microsoft Windows 11 Pro 10.0.26100",
      "architecture": "AMD64",
      "nodeVersion": "v24.16.0",
      "outcome": "pass",
      "caseCount": 12,
      "artifactSha256": "48bb913017b3b47c3fabb4ee67ea1eebeed10e07a8147e501090c23ff3c666f8"
    }
  ],
  "limitations": [
    "This is reference-harness evidence, not provider conformance or certification evidence.",
    "The exact standard pin is 04e34ff750d4567628b85b9131d90759e6ac3c62; the source archive SHA-256 is d6ef33a111c149e13f54c4d8ad7cd65fe5d35d550c9e23b9cebd56cea1a5538e.",
    "Raw Linux, macOS, and Windows observation SHA-256 values are e8feff2eba3a31211c92a1b49b9073e4434db9ba3607d7dc7ca07dfbf67aa6d8, 99933e3fbed6c7dc739a17374585b5c10031db53b278743b5dbf20c7f998342a, and f2853a4617064c15a00c518d228efaf5281cd864b1ad115e2975a287d2aa4654. Removing only per-case timestamps and serializing with sorted keys yields the same SHA-256 627815e01f48350c5d22fe0d69f6a23339dab6f033a95f22541a46ed704c5d5f on all three systems.",
    "The harness models declaration validation, version-bound materialization, atomic selector behavior, revision retention, limits, and secret containment locally. Cloudflare, EdgeOne, and Deislet still require live create, activate, invoke, rotate, rollback, delete, and fault-injection evidence.",
    "No provider account or management credential was used. The secret sentinel scan covers the reference observation surfaces and cannot substitute for scanning a production build cache, provider log stream, audit store, or failed deployment."
  ]
}
